id,date_rapport,type_information,categorie,domaine,titre,organisation_principale,source_principale,url_principale,url_secondaire,date_publication,date_evenement,niveau_maturite,note_importance,prepublication,confirmation_croisee,statut_verification,rapport
2026-07-13-N01,2026-07-13,actualite,Nouveaux modeles d'IA,IA,OpenAI ouvre au grand public la famille de modeles GPT-5.6 (Sol Terra Luna),OpenAI,OpenAI,https://openai.com/index/previewing-gpt-5-6-sol/,https://www.techtimes.com/articles/320037/20260709/gpt-56-goes-public-today-sol-terra-luna-return-base-model-wars.htm,2026-07-09,2026-07-09,deploiement,5,non,oui,verifie via recherche web - fetch direct bloque (403),reports/daily/2026/2026-07-13.md
2026-07-13-N02,2026-07-13,actualite,Securite gouvernance et conformite,IA,Apple assigne OpenAI en justice pour vol allegue de secrets commerciaux,Apple / OpenAI,CNBC,https://www.cnbc.com/2026/07/10/apple-openai-lawsuit-trade-secrets.html,https://techcrunch.com/2026/07/10/apple-sues-openai-over-alleged-trade-secret-theft/,2026-07-10,2026-07-10,annonce,4,non,oui,confirme par plusieurs sources independantes,reports/daily/2026/2026-07-13.md
2026-07-13-N03,2026-07-13,actualite,Robotique,IA,Mistral AI devoile Robostral Navigate modele de navigation robotique monocamera,Mistral AI,Mistral AI,https://mistral.ai/news/robostral-navigate/,https://www.bloomberg.com/news/articles/2026-07-08/mistral-ai-releases-robotics-model-to-support-physical-ai-push,2026-07-08,2026-07-08,annonce,3,non,oui,verifie via recherche web - fetch direct bloque (403),reports/daily/2026/2026-07-13.md
2026-07-13-N04,2026-07-13,actualite,Reglementation et AI Act,IA,La Commission europeenne presente son plan d'action Cybersecurite et Intelligence artificielle,Commission europeenne,Commission europeenne,https://commission.europa.eu/news-and-media/news/new-eu-plan-address-risks-and-opportunities-advanced-ai-cybersecurity-2026-07-07_en,https://www.hpcwire.com/aiwire/2026/07/09/european-commission-presents-eu-action-plan-on-cybersecurity-and-artificial-intelligence/,2026-07-07,2026-07-07,annonce,4,non,oui,verifie via recherche web - fetch direct bloque (403),reports/daily/2026/2026-07-13.md
2026-07-13-N05,2026-07-13,actualite,Investissements partenariats et acquisitions,IA,SambaNova leve 1 milliard de dollars valorisation a 11 milliards de dollars,SambaNova,General Atlantic,https://www.generalatlantic.com/media-article/sambanova-completes-first-close-of-1-billion-financing-at-11-billion-valuation/,https://techcrunch.com/2026/07/08/sambanova-draws-1b-at-11b-valuation-in-series-f-first-close/,2026-07-08,2026-07-08,annonce,3,non,oui,verifie via recherche web - fetch direct bloque (403),reports/daily/2026/2026-07-13.md
2026-07-13-D01,2026-07-13,decouverte,Decouverte de medicaments,Sante,Rentosertib premier medicament concu par IA generative a entrer en phase III,Insilico Medicine,Insilico Medicine,https://insilico.com/news/xmjsn4l091-insilico-initiates-phase-iii-clinical-tr,https://www.biospace.com/press-releases/insilico-initiates-phase-iii-clinical-trial-for-rentosertib-its-ai-empowered-tnik-inhibitor-for-idiopathic-pulmonary-fibrosis,2026-07-07,2026-07-07,pilote,5,non,oui,verifie via recherche web - fetch direct bloque (403),reports/daily/2026/2026-07-13.md
2026-07-13-D02,2026-07-13,decouverte,Sante et medecine,Sante,MIRA et AMIE agents IA autonomes evalues sur cas cliniques reels d'urgences,Nature / Google,Nature,https://www.nature.com/articles/s41586-026-10764-5,https://www.sciencemediacentre.org/expert-reaction-to-presentation-of-two-new-medical-ai-models-for-patient-management-mira-and-amie/,2026-06-17,2026-06-17,preuve de concept,4,non,oui,publication evaluee par les pairs,reports/daily/2026/2026-07-13.md
2026-07-13-D03,2026-07-13,decouverte,Physique / Materiaux,Physique,Decouverte guidee par apprentissage automatique de deux supraconducteurs kagome,Aalto University et consortium,Physical Review Research,https://journals.aps.org/prresearch/abstract/10.1103/lpqj-7hyg,https://www.sciencedaily.com/releases/2026/07/260701205006.htm,2026-06-17,2026-06-17,resultat de laboratoire,3,non,oui,publication evaluee par les pairs,reports/daily/2026/2026-07-13.md
2026-07-13-D04,2026-07-13,decouverte,Astronomie et spatial,Astronomie,RHINE reseau de neurones pour simuler la nucleosynthese r dans les fusions d'etoiles a neutrons,GSI/FAIR,GSI,https://www.gsi.de/en/start/news/details/2026/06/08/rhine,https://phys.org/news/2026-06-neutron-star-merger-simulations-gain.html,2026-06-08,2026-06-08,resultat de laboratoire,3,non,oui,publication evaluee par les pairs,reports/daily/2026/2026-07-13.md
2026-07-13-D05,2026-07-13,decouverte,Chimie,Chimie,Reseau de neurones pour caracteriser la structure moleculaire de l'eau surfondue,Universite d'Osaka,Communications Chemistry (Springer Nature),https://www.nature.com/articles/s42004-026-02097-1,https://www.eurekalert.org/news-releases/1134535,2026-07-06,2026-07-06,resultat de laboratoire,3,non,oui,publication evaluee par les pairs,reports/daily/2026/2026-07-13.md
2026-07-14-N01,2026-07-14,actualite,Infrastructures centres de donnees et semi-conducteurs,IA,TSMC publie un chiffre d'affaires trimestriel record porte par la demande de puces IA,TSMC,TSMC,https://pr.tsmc.com/english/news/3323,https://www.cnbc.com/2026/07/13/tsmc-june-revenue-rises-percent-ahead-second-quarter.html,2026-07-13,2026-07-13,commercialisation,4,non,oui,verifie via recherche web - fetch direct bloque (403),reports/daily/2026/2026-07-14.md
2026-07-14-N02,2026-07-14,actualite,Claude Code GitHub et programmation assistee,IA,Meta lance Muse Spark 1.1 modele dedie au codage agentique,Meta,Meta AI,https://ai.meta.com/blog/introducing-muse-spark-meta-model-api/,https://techcrunch.com/2026/07/09/meta-enters-the-crowded-ai-coding-battle-with-muse-spark-1-1/,2026-07-09,2026-07-09,apercu public,3,non,oui,confirme par plusieurs sources independantes,reports/daily/2026/2026-07-14.md
2026-07-14-N03,2026-07-14,actualite,Open source,IA,Tencent publie Hy3 295 milliards de parametres en open source sous licence Apache 2.0,Tencent,Tencent,https://www.tencent.com/en-us/articles/2202386.html,https://venturebeat.com/technology/tencents-apache-licensed-hy3-takes-on-glm-5-2-at-half-the-size-and-wins-everywhere-except-coding,2026-07-06,2026-07-06,deploiement,3,non,oui,confirme par une source independante - benchmarks non verifies independamment,reports/daily/2026/2026-07-14.md
2026-07-14-N04,2026-07-14,actualite,Nouveaux modeles d'IA / Reglementation et AI Act,IA,xAI lance Grok 4.5 deploiement toujours bloque dans l'UE,xAI,xAI,https://x.ai/news/grok-4-5,https://www.heise.de/en/news/SpaceXAI-introduces-AI-model-Grok-4-5-EU-users-must-wait-11359422.html,2026-07-08,2026-07-08,deploiement hors UE,4,non,oui,confirme par plusieurs sources independantes,reports/daily/2026/2026-07-14.md
2026-07-14-N05,2026-07-14,actualite,Gestion de projet IA / Securite gouvernance et conformite,IA,La Reserve federale americaine cree un groupe de travail sur la productivite et l'emploi face a l'IA,Reserve federale americaine,Reserve federale americaine,https://www.federalreserve.gov/newsevents/pressreleases/monetary20260709a.htm,https://www.cnbc.com/2026/07/09/kevin-warsh-names-members-of-his-federal-reserve-task-forces-including-marc-andreessen-doug-mcmillon.html,2026-07-09,2026-07-09,annonce,3,non,oui,confirme par plusieurs sources independantes,reports/daily/2026/2026-07-14.md
2026-07-14-D01,2026-07-14,decouverte,Sante et medecine,Sante,NeuroVFM modele de fondation en neuro-imagerie entraine a l'echelle d'un systeme hospitalier,Universite du Michigan,Nature Medicine,https://www.nature.com/articles/s41591-026-04497-1,https://www.marktechpost.com/2026/07/12/meet-neurovfm-a-new-neuroimaging-foundation-model-trained-with-vol-jepa-on-uncurated-clinical-mri-and-ct-volumes/,2026-07-10,2026-01 (semaine de test - jour exact non precise),preuve de concept,4,non,oui,publication evaluee par les pairs - fetch direct nature.com bloque (403) verifie via sources tierces,reports/daily/2026/2026-07-14.md
2026-07-14-D02,2026-07-14,decouverte,Astronomie et spatial,Astronomie,Le telescope Euclid decouvre 31 quasars primordiaux preselectionnes par apprentissage automatique,ESA / Euclid Consortium,Astronomy & Astrophysics,https://www.aanda.org/articles/aa/full_html/2026/07/aa58883-26/aa58883-26.html,https://science.nasa.gov/blogs/science-news/2026/07/06/esas-euclid-space-telescope-finds-universes-most-ancient-quasars/,2026-07-06,2026-07-06,resultat de laboratoire,4,non,oui,publication evaluee par les pairs,reports/daily/2026/2026-07-14.md
2026-07-14-D03,2026-07-14,decouverte,Materiaux,Materiaux,Cadre d'apprentissage par renforcement pour ameliorer la generation de nouveaux cristaux,Imperial College London,Nature Machine Intelligence,https://www.nature.com/articles/s42256-026-01262-4,aucune,2026-07-06,2026-07-06,resultat de laboratoire,3,non,non,publication evaluee par les pairs - preprint arxiv anterieur (nov 2025) - aucune source de presse independante identifiee,reports/daily/2026/2026-07-14.md
2026-07-14-D04,2026-07-14,decouverte,Agriculture,Agriculture,Semis a taux variable pilote par apprentissage automatique en grandes cultures,Universite du Missouri,Agronomy Journal,https://acsess.onlinelibrary.wiley.com/doi/10.1002/agj2.70373,https://showme.missouri.edu/2026/planting-the-future-mizzou-researchers-put-ai-to-work-on-the-farm/,2026-07-08,2026-07-08,preuve de concept,3,non,oui,publication evaluee par les pairs,reports/daily/2026/2026-07-14.md
2026-07-14-D05,2026-07-14,decouverte,Genomique / Decouverte de medicaments,Sante,Criblage CRISPR guide par IA identifie des cibles therapeutiques contre le psoriasis,Chan Zuckerberg Biohub,Nature Communications,https://doi.org/10.1038/s41467-026-75249-5,https://www.eurekalert.org/news-releases/1135271,2026-07-08,2026-07-08 (date exacte de mise en ligne non confirmee),validation preclinique,3,non,oui,publication evaluee par les pairs - preprint bioRxiv anterieur (fevrier 2026) - date exacte non confirmee par fetch direct,reports/daily/2026/2026-07-14.md
2026-07-17-N01,2026-07-17,actualite,Nouveaux modeles d'IA / Open source,IA,Thinking Machines Lab publie Inkling premier modele a poids ouverts,Thinking Machines Lab,Thinking Machines Lab,https://thinkingmachines.ai/news/introducing-inkling/,https://techcrunch.com/2026/07/15/thinking-machines-amps-up-its-bet-against-one-size-fits-all-ai-with-its-first-open-model-inkling/,2026-07-15,2026-07-15,deploiement,4,non,oui,confirme par plusieurs sources independantes - fetch direct bloque (403),reports/daily/2026/2026-07-17.md
2026-07-17-N02,2026-07-17,actualite,Securite gouvernance et conformite,IA,Hugging Face divulgue une intrusion attribuee a un agent IA autonome,Hugging Face,Hugging Face,https://huggingface.co/blog/security-incident-july-2026,aucune,2026-07-16,2026-07-16 (divulgation - date exacte de l'intrusion non precisee),incident divulgue,3,non,non,non confirme par une source independante a ce jour - fetch direct bloque (403),reports/daily/2026/2026-07-17.md
2026-07-17-N03,2026-07-17,actualite,Investissements partenariats et acquisitions,IA,Anthropic Blackstone et Hellman and Friedman lancent Ode with Anthropic,Anthropic / Blackstone / Hellman and Friedman,BusinessWire,https://www.businesswire.com/news/home/20260715205134/en/Anthropic-Blackstone-and-Hellman-Friedman-Introduce-Ode-with-Anthropic-an-Enterprise-AI-Services-Firm,https://techcrunch.com/2026/07/15/anthropic-blackstone-bet-the-next-trillion-dollar-ai-business-is-implementation-not-models/,2026-07-15,2026-07-15,lancement operationnel,3,non,oui,confirme par plusieurs sources independantes - fetch direct bloque (403),reports/daily/2026/2026-07-17.md
2026-07-17-N04,2026-07-17,actualite,Robotique,IA,Microagi leve 55 millions de dollars plus gros tour d'amorcage jamais realise en Allemagne,Microagi,Microagi,https://www.microagi.ai/articles/seed,https://sifted.eu/articles/munich-robotics-startup-microagi-raises-55m-germanys-largest-ever-seed-round,2026-07-16,2026-07-16,financement d'amorcage,3,non,oui,confirme par plusieurs sources independantes - fetch direct bloque (403),reports/daily/2026/2026-07-17.md
2026-07-17-N05,2026-07-17,actualite,Infrastructures centres de donnees et semi-conducteurs,IA,TSMC engage 100 milliards de dollars supplementaires aux Etats-Unis total 265 milliards,TSMC,Departement du Commerce des Etats-Unis,https://www.commerce.gov/news/press-releases/2026/07/trump-administration-secures-additional-100-billion-us-semiconductor,https://www.upi.com/Top_News/US/2026/07/16/TSMC-invests-additional-100-billion-in-Arizona-facilities/9791784210133/,2026-07-16,2026-07-16,annonce d'investissement,4,non,oui,confirme par plusieurs sources independantes - fetch direct bloque (403),reports/daily/2026/2026-07-17.md
2026-07-17-D01,2026-07-17,decouverte,Physique,Physique,Un agent d'apprentissage par renforcement stabilise en temps reel un ordinateur quantique de Google,Google Quantum AI,Nature,https://www.nature.com/articles/s41586-026-10759-2,https://phys.org/news/2026-07-faster-quantum.html,2026-07-08,2026-07-08,resultat de laboratoire,4,non,oui,publication evaluee par les pairs - fetch direct bloque (403),reports/daily/2026/2026-07-17.md
2026-07-17-D02,2026-07-17,decouverte,Sante et medecine,Sante,Depistage du cancer colorectal guide par apprentissage automatique reduit la mortalite a deux ans,Geisinger,EurekAlert / INFORMS,https://www.eurekalert.org/news-releases/1135090,https://www.hospimedica.com/critical-care/articles/294811836/ai-guided-outreach-system-improves-colorectal-cancer-screening.html,2026-07,2019-2026 (programme evalue retrospectivement),deploiement operationnel evalue,4,non,oui,publication evaluee par les pairs - etude observationnelle - fetch direct bloque (403),reports/daily/2026/2026-07-17.md
2026-07-17-D03,2026-07-17,decouverte,Decouverte de medicaments,Sante,ABS-201 anticorps concu par IA generative d'Absci entre en phase 1 et attire un investissement d'Eli Lilly,Absci Corp,Absci Corp (GlobeNewswire),https://www.globenewswire.com/news-release/2026/06/24/3316681/0/en/Absci-Announces-Positive-Interim-Phase-1-Data-from-the-HEADLINE-Trial-of-ABS-201-a-Novel-Antibody-Targeting-the-Prolactin-Receptor-PRLR.html,https://fortune.com/2026/07/01/eli-lilly-mounjaro-zepbound-hair-loss-absci40-million-injectables/,2026-06-24,2026-06-24 (donnees phase 1) et 2026-07-01 (financement),validation clinique precoce,3,non,oui,communique d'entreprise - pas de publication evaluee par les pairs identifiee,reports/daily/2026/2026-07-17.md
2026-07-17-D04,2026-07-17,decouverte,Archeologie,Archeologie,Le Vesuvius Challenge lit integralement un rouleau de papyrus d'Herculanum grace a l'IA,Vesuvius Challenge,Vesuvius Challenge (scrollprize.org),https://scrollprize.org/firstscroll,https://www.cnn.com/2026/06/26/science/papyrus-scroll-vesuvius-ai-scli-intl,2026-06-25,2026-06-25,preuve de concept,4,oui,oui,prepublication arXiv non evaluee par les pairs - fetch direct bloque (403),reports/daily/2026/2026-07-17.md
2026-07-17-D05,2026-07-17,decouverte,Materiaux,Materiaux,Un reseau de neurones combinant deux familles de catalyseurs guide la decouverte d'un catalyseur pour l'electrolyse de l'eau,Equipe de recherche internationale,Nature Materials,https://www.nature.com/articles/s41563-026-02622-6,aucune,2026-05-28,2026-05-28,resultat valide experimentalement,3,non,non,publication evaluee par les pairs - aucune source de presse independante identifiee - fetch direct bloque (403),reports/daily/2026/2026-07-17.md
