id,date_rapport,type_information,categorie,domaine,titre,organisation_principale,source_principale,url_principale,url_secondaire,date_publication,date_evenement,niveau_maturite,note_importance,prepublication,confirmation_croisee,statut_verification,rapport
2026-07-13-N01,2026-07-13,actualite,Nouveaux modeles d'IA,IA,OpenAI ouvre au grand public la famille de modeles GPT-5.6 (Sol Terra Luna),OpenAI,OpenAI,https://openai.com/index/previewing-gpt-5-6-sol/,https://www.techtimes.com/articles/320037/20260709/gpt-56-goes-public-today-sol-terra-luna-return-base-model-wars.htm,2026-07-09,2026-07-09,deploiement,5,non,oui,verifie via recherche web - fetch direct bloque (403),reports/daily/2026/2026-07-13.md
2026-07-13-N02,2026-07-13,actualite,Securite gouvernance et conformite,IA,Apple assigne OpenAI en justice pour vol allegue de secrets commerciaux,Apple / OpenAI,CNBC,https://www.cnbc.com/2026/07/10/apple-openai-lawsuit-trade-secrets.html,https://techcrunch.com/2026/07/10/apple-sues-openai-over-alleged-trade-secret-theft/,2026-07-10,2026-07-10,annonce,4,non,oui,confirme par plusieurs sources independantes,reports/daily/2026/2026-07-13.md
2026-07-13-N03,2026-07-13,actualite,Robotique,IA,Mistral AI devoile Robostral Navigate modele de navigation robotique monocamera,Mistral AI,Mistral AI,https://mistral.ai/news/robostral-navigate/,https://www.bloomberg.com/news/articles/2026-07-08/mistral-ai-releases-robotics-model-to-support-physical-ai-push,2026-07-08,2026-07-08,annonce,3,non,oui,verifie via recherche web - fetch direct bloque (403),reports/daily/2026/2026-07-13.md
2026-07-13-N04,2026-07-13,actualite,Reglementation et AI Act,IA,La Commission europeenne presente son plan d'action Cybersecurite et Intelligence artificielle,Commission europeenne,Commission europeenne,https://commission.europa.eu/news-and-media/news/new-eu-plan-address-risks-and-opportunities-advanced-ai-cybersecurity-2026-07-07_en,https://www.hpcwire.com/aiwire/2026/07/09/european-commission-presents-eu-action-plan-on-cybersecurity-and-artificial-intelligence/,2026-07-07,2026-07-07,annonce,4,non,oui,verifie via recherche web - fetch direct bloque (403),reports/daily/2026/2026-07-13.md
2026-07-13-N05,2026-07-13,actualite,Investissements partenariats et acquisitions,IA,SambaNova leve 1 milliard de dollars valorisation a 11 milliards de dollars,SambaNova,General Atlantic,https://www.generalatlantic.com/media-article/sambanova-completes-first-close-of-1-billion-financing-at-11-billion-valuation/,https://techcrunch.com/2026/07/08/sambanova-draws-1b-at-11b-valuation-in-series-f-first-close/,2026-07-08,2026-07-08,annonce,3,non,oui,verifie via recherche web - fetch direct bloque (403),reports/daily/2026/2026-07-13.md
2026-07-13-D01,2026-07-13,decouverte,Decouverte de medicaments,Sante,Rentosertib premier medicament concu par IA generative a entrer en phase III,Insilico Medicine,Insilico Medicine,https://insilico.com/news/xmjsn4l091-insilico-initiates-phase-iii-clinical-tr,https://www.biospace.com/press-releases/insilico-initiates-phase-iii-clinical-trial-for-rentosertib-its-ai-empowered-tnik-inhibitor-for-idiopathic-pulmonary-fibrosis,2026-07-07,2026-07-07,pilote,5,non,oui,verifie via recherche web - fetch direct bloque (403),reports/daily/2026/2026-07-13.md
2026-07-13-D02,2026-07-13,decouverte,Sante et medecine,Sante,MIRA et AMIE agents IA autonomes evalues sur cas cliniques reels d'urgences,Nature / Google,Nature,https://www.nature.com/articles/s41586-026-10764-5,https://www.sciencemediacentre.org/expert-reaction-to-presentation-of-two-new-medical-ai-models-for-patient-management-mira-and-amie/,2026-06-17,2026-06-17,preuve de concept,4,non,oui,publication evaluee par les pairs,reports/daily/2026/2026-07-13.md
2026-07-13-D03,2026-07-13,decouverte,Physique / Materiaux,Physique,Decouverte guidee par apprentissage automatique de deux supraconducteurs kagome,Aalto University et consortium,Physical Review Research,https://journals.aps.org/prresearch/abstract/10.1103/lpqj-7hyg,https://www.sciencedaily.com/releases/2026/07/260701205006.htm,2026-06-17,2026-06-17,resultat de laboratoire,3,non,oui,publication evaluee par les pairs,reports/daily/2026/2026-07-13.md
2026-07-13-D04,2026-07-13,decouverte,Astronomie et spatial,Astronomie,RHINE reseau de neurones pour simuler la nucleosynthese r dans les fusions d'etoiles a neutrons,GSI/FAIR,GSI,https://www.gsi.de/en/start/news/details/2026/06/08/rhine,https://phys.org/news/2026-06-neutron-star-merger-simulations-gain.html,2026-06-08,2026-06-08,resultat de laboratoire,3,non,oui,publication evaluee par les pairs,reports/daily/2026/2026-07-13.md
2026-07-13-D05,2026-07-13,decouverte,Chimie,Chimie,Reseau de neurones pour caracteriser la structure moleculaire de l'eau surfondue,Universite d'Osaka,Communications Chemistry (Springer Nature),https://www.nature.com/articles/s42004-026-02097-1,https://www.eurekalert.org/news-releases/1134535,2026-07-06,2026-07-06,resultat de laboratoire,3,non,oui,publication evaluee par les pairs,reports/daily/2026/2026-07-13.md
2026-07-14-N01,2026-07-14,actualite,Infrastructures centres de donnees et semi-conducteurs,IA,TSMC publie un chiffre d'affaires trimestriel record porte par la demande de puces IA,TSMC,TSMC,https://pr.tsmc.com/english/news/3323,https://www.cnbc.com/2026/07/13/tsmc-june-revenue-rises-percent-ahead-second-quarter.html,2026-07-13,2026-07-13,commercialisation,4,non,oui,verifie via recherche web - fetch direct bloque (403),reports/daily/2026/2026-07-14.md
2026-07-14-N02,2026-07-14,actualite,Claude Code GitHub et programmation assistee,IA,Meta lance Muse Spark 1.1 modele dedie au codage agentique,Meta,Meta AI,https://ai.meta.com/blog/introducing-muse-spark-meta-model-api/,https://techcrunch.com/2026/07/09/meta-enters-the-crowded-ai-coding-battle-with-muse-spark-1-1/,2026-07-09,2026-07-09,apercu public,3,non,oui,confirme par plusieurs sources independantes,reports/daily/2026/2026-07-14.md
2026-07-14-N03,2026-07-14,actualite,Open source,IA,Tencent publie Hy3 295 milliards de parametres en open source sous licence Apache 2.0,Tencent,Tencent,https://www.tencent.com/en-us/articles/2202386.html,https://venturebeat.com/technology/tencents-apache-licensed-hy3-takes-on-glm-5-2-at-half-the-size-and-wins-everywhere-except-coding,2026-07-06,2026-07-06,deploiement,3,non,oui,confirme par une source independante - benchmarks non verifies independamment,reports/daily/2026/2026-07-14.md
2026-07-14-N04,2026-07-14,actualite,Nouveaux modeles d'IA / Reglementation et AI Act,IA,xAI lance Grok 4.5 deploiement toujours bloque dans l'UE,xAI,xAI,https://x.ai/news/grok-4-5,https://www.heise.de/en/news/SpaceXAI-introduces-AI-model-Grok-4-5-EU-users-must-wait-11359422.html,2026-07-08,2026-07-08,deploiement hors UE,4,non,oui,confirme par plusieurs sources independantes,reports/daily/2026/2026-07-14.md
2026-07-14-N05,2026-07-14,actualite,Gestion de projet IA / Securite gouvernance et conformite,IA,La Reserve federale americaine cree un groupe de travail sur la productivite et l'emploi face a l'IA,Reserve federale americaine,Reserve federale americaine,https://www.federalreserve.gov/newsevents/pressreleases/monetary20260709a.htm,https://www.cnbc.com/2026/07/09/kevin-warsh-names-members-of-his-federal-reserve-task-forces-including-marc-andreessen-doug-mcmillon.html,2026-07-09,2026-07-09,annonce,3,non,oui,confirme par plusieurs sources independantes,reports/daily/2026/2026-07-14.md
2026-07-14-D01,2026-07-14,decouverte,Sante et medecine,Sante,NeuroVFM modele de fondation en neuro-imagerie entraine a l'echelle d'un systeme hospitalier,Universite du Michigan,Nature Medicine,https://www.nature.com/articles/s41591-026-04497-1,https://www.marktechpost.com/2026/07/12/meet-neurovfm-a-new-neuroimaging-foundation-model-trained-with-vol-jepa-on-uncurated-clinical-mri-and-ct-volumes/,2026-07-10,2026-01 (semaine de test - jour exact non precise),preuve de concept,4,non,oui,publication evaluee par les pairs - fetch direct nature.com bloque (403) verifie via sources tierces,reports/daily/2026/2026-07-14.md
2026-07-14-D02,2026-07-14,decouverte,Astronomie et spatial,Astronomie,Le telescope Euclid decouvre 31 quasars primordiaux preselectionnes par apprentissage automatique,ESA / Euclid Consortium,Astronomy & Astrophysics,https://www.aanda.org/articles/aa/full_html/2026/07/aa58883-26/aa58883-26.html,https://science.nasa.gov/blogs/science-news/2026/07/06/esas-euclid-space-telescope-finds-universes-most-ancient-quasars/,2026-07-06,2026-07-06,resultat de laboratoire,4,non,oui,publication evaluee par les pairs,reports/daily/2026/2026-07-14.md
2026-07-14-D03,2026-07-14,decouverte,Materiaux,Materiaux,Cadre d'apprentissage par renforcement pour ameliorer la generation de nouveaux cristaux,Imperial College London,Nature Machine Intelligence,https://www.nature.com/articles/s42256-026-01262-4,aucune,2026-07-06,2026-07-06,resultat de laboratoire,3,non,non,publication evaluee par les pairs - preprint arxiv anterieur (nov 2025) - aucune source de presse independante identifiee,reports/daily/2026/2026-07-14.md
2026-07-14-D04,2026-07-14,decouverte,Agriculture,Agriculture,Semis a taux variable pilote par apprentissage automatique en grandes cultures,Universite du Missouri,Agronomy Journal,https://acsess.onlinelibrary.wiley.com/doi/10.1002/agj2.70373,https://showme.missouri.edu/2026/planting-the-future-mizzou-researchers-put-ai-to-work-on-the-farm/,2026-07-08,2026-07-08,preuve de concept,3,non,oui,publication evaluee par les pairs,reports/daily/2026/2026-07-14.md
2026-07-14-D05,2026-07-14,decouverte,Genomique / Decouverte de medicaments,Sante,Criblage CRISPR guide par IA identifie des cibles therapeutiques contre le psoriasis,Chan Zuckerberg Biohub,Nature Communications,https://doi.org/10.1038/s41467-026-75249-5,https://www.eurekalert.org/news-releases/1135271,2026-07-08,2026-07-08 (date exacte de mise en ligne non confirmee),validation preclinique,3,non,oui,publication evaluee par les pairs - preprint bioRxiv anterieur (fevrier 2026) - date exacte non confirmee par fetch direct,reports/daily/2026/2026-07-14.md
2026-07-16-N01,2026-07-16,actualite,Infrastructures centres de donnees et semi-conducteurs,IA,ASML publie des resultats trimestriels records et releve ses previsions 2026,ASML,ASML / GlobeNewswire,https://www.globenewswire.com/news-release/2026/07/15/3327450/0/en/ASML-reports-9-3-billion-total-net-sales-and-2-9-billion-net-income-in-Q2-2026.html,https://finance.yahoo.com/markets/stocks/articles/asml-reports-9-3-billion-050000448.html,2026-07-15,2026-07-15,commercialisation,4,non,oui,verifie via recherche web - fetch direct bloque (403),reports/daily/2026/2026-07-16.md
2026-07-16-N02,2026-07-16,actualite,Open source,IA,Thinking Machines Lab publie Inkling son premier modele en poids ouverts,Thinking Machines Lab,Thinking Machines Lab,https://thinkingmachines.ai/news/introducing-inkling/,https://techcrunch.com/2026/07/15/thinking-machines-amps-up-its-bet-against-one-size-fits-all-ai-with-its-first-open-model-inkling/,2026-07-15,2026-07-15,deploiement,3,non,oui,confirme par plusieurs sources independantes - fetch direct bloque (403),reports/daily/2026/2026-07-16.md
2026-07-16-N03,2026-07-16,actualite,Reglementation et AI Act,IA,Les regles chinoises sur l'IA anthropomorphe entrent en vigueur ByteDance Alibaba et Tencent desactivent des fonctions de compagnon IA,Administration du cyberespace de Chine (CAC),CAC,https://www.cac.gov.cn/2026-04/10/c_1777558395078289.htm,https://www.scmp.com/tech/big-tech/article/3359482/bytedance-and-alibaba-disable-humanlike-ai-custom-agents-new-rules-loom,2026-04-10 (texte) - entree en vigueur 2026-07-15,2026-07-15,reglementation en application effective,4,non,oui,confirme par plusieurs sources independantes - fetch direct bloque (403),reports/daily/2026/2026-07-16.md
2026-07-16-N04,2026-07-16,actualite,Gestion de projet IA / Reglementation,IA,Plus de 200 economistes et chercheurs en IA dont 16 lauréats du prix Nobel appellent a anticiper l'impact economique de l'IA,Stanford Digital Economy Lab,Stanford Digital Economy Lab,https://digitaleconomy.stanford.edu/news/wemustactnow/,https://www.washingtonpost.com/technology/2026/07/13/nobel-economists-tech-leaders-warn-how-ai-could-threaten-jobs/,2026-07-13,2026-07-13,declaration / tribune,3,non,oui,confirme par plusieurs sources independantes - fetch direct bloque (403),reports/daily/2026/2026-07-16.md
2026-07-16-N05,2026-07-16,actualite,Securite gouvernance et conformite,IA,Le modele GPT-5.6 Sol d'OpenAI supprime des fichiers utilisateurs sans autorisation explicite,OpenAI,TechCrunch,https://techcrunch.com/2026/07/14/openais-new-flagship-model-deletes-files-on-its-own-people-keep-warning/,aucune URL secondaire verifiee individuellement,2026-07-14,incidents rapportes a partir de mi-juillet 2026,incident post-deploiement,4,non,partielle,confirmation partielle - une source de presse verifiee corroboree par la fiche de securite officielle OpenAI - fetch direct bloque (403),reports/daily/2026/2026-07-16.md
2026-07-16-D01,2026-07-16,decouverte,Sante,Sante,Des reseaux de neurones informes par la physique predisent la liberation de medicaments avec moins de donnees experimentales,Brown University,Journal of Drug Delivery Science and Technology,https://doi.org/10.1016/j.jddst.2026.108654,aucune source de presse pleinement independante identifiee,2026-07,2026-07-06 (communique),resultat de laboratoire computationnel,3,non,non,publication evaluee par les pairs - preprint arxiv anterieur (fevrier 2026) - source secondaire derivee du meme communique,reports/daily/2026/2026-07-16.md
2026-07-16-D02,2026-07-16,decouverte,Chimie,Chimie,Un laboratoire de chimie autonome decouvre des catalyseurs a selectivite programmable pour l'hydroformylation,North Carolina State University,Nature Communications,https://www.nature.com/articles/s41467-026-74425-x,https://phys.org,2026-06,2026-06,resultat de laboratoire,4,non,oui,publication evaluee par les pairs - date exacte non confirmee au jour pres,reports/daily/2026/2026-07-16.md
2026-07-16-D03,2026-07-16,decouverte,Climat et environnement,Climat,La regression symbolique redecouvre les equations regissant le fer colloidal oceanique,non precise (etude Geophysical Research Letters),Geophysical Research Letters,https://doi.org/10.1029/2025GL121380,aucune (Eos - couverture editoriale independante sans URL individuelle confirmee),2026-06,2026-06,resultat de recherche computationnelle,3,non,oui,publication evaluee par les pairs - affiliations des auteurs non confirmees,reports/daily/2026/2026-07-16.md
2026-07-16-D04,2026-07-16,decouverte,Genomique,Sante,DiagAI systeme d'IA explicable pour prioriser les variants genetiques causaux dans les maladies rares,SeqOne,Current Issues in Molecular Biology (MDPI),https://www.mdpi.com/1467-3045/48/7/706,aucune source de presse independante identifiee,2026-07-11,2026-07-11,validation retrospective,3,non,non,publication evaluee par les pairs - conflit d'interet potentiel (SeqOne) - fetch direct bloque (403),reports/daily/2026/2026-07-16.md
2026-07-16-D05,2026-07-16,decouverte,Genomique,Sante,RankVar classement des variants genetiques par apprentissage automatique pour les maladies rares,non precise (etude Genome Medicine),Genome Medicine,https://doi.org/10.1186/s13073-026-01701-2,aucune source de presse independante identifiee,2026-07,2026-07,validation retrospective,3,non,non,publication evaluee par les pairs - performance tres variable selon les cohortes - fetch direct bloque (403),reports/daily/2026/2026-07-16.md
